{
  "accounting": [
    {
      "path": "src/db.js",
      "range": [
        1,
        40
      ],
      "status": "examined",
      "by": [
        "claims-1"
      ]
    },
    {
      "path": "src/db.js",
      "range": [
        41,
        80
      ],
      "status": "scanner-only",
      "by": [
        "4444444444444444444444444444444444444444444444444444444444444444"
      ]
    },
    {
      "path": "src/db.js",
      "range": [
        81,
        120
      ],
      "status": "unexamined",
      "by": []
    }
  ],
  "scanner_rows": [
    {
      "tool": "semgrep",
      "version": "1.90.0",
      "import_sha256": "4444444444444444444444444444444444444444444444444444444444444444",
      "paths": [
        "src/db.js"
      ]
    }
  ],
  "scope_sha256": "2222222222222222222222222222222222222222222222222222222222222222",
  "examined_sha256": "7777777777777777777777777777777777777777777777777777777777777777",
  "indeterminate": false
}
